{
  "schemaVersion": "preset-layout/1",
  "id": "example_cottage_store_court",
  "name": "木屋与仓库庭院示例",
  "description": "19×19：木屋主体、独立仓库、公共庭院；三处组团入口。",
  "category": "residential",
  "tags": [
    "compound",
    "example"
  ],
  "sizeTier": "medium",
  "size": [
    19,
    16,
    19
  ],
  "reservedMask": [
    "###################",
    "###################",
    "###################",
    "###################",
    "###################",
    "###################",
    "###################",
    "###################",
    "###################",
    "###################",
    "###################",
    "###################",
    "###################",
    "###################",
    "###################",
    "###################",
    "###################",
    "###################",
    "###################"
  ],
  "groundSymbol": "g",
  "palette": {
    ".": "minecraft:air",
    "g": "minecraft:grass_block",
    "p": "minecraft:gravel",
    "A": "minecraft:stone_bricks",
    "B": "minecraft:oak_planks",
    "C": "minecraft:spruce_log",
    "D": "minecraft:glass_pane",
    "E": "minecraft:dark_oak_planks",
    "F": "minecraft:bricks"
  },
  "components": [
    {
      "id": "house",
      "role": "main",
      "origin": [
        1,
        1
      ],
      "mask": [
        "#######",
        "#######",
        "#######",
        "#######",
        "#######",
        "#######",
        "#######",
        "#######",
        "#######"
      ],
      "layers": [
        [
          "AAAAAAA",
          "AAAAAAA",
          "AAAAAAA",
          "AAAAAAA",
          "AAAAAAA",
          "AAAAAAA",
          "AAAAAAA",
          "AAAAAAA",
          "AAAAAAA"
        ],
        [
          "CBBBCBB",
          "B.....B",
          "B.....B",
          "B.....B",
          "C.....B",
          "B.....B",
          "B.....B",
          "B.....B",
          "CBB.CBB"
        ],
        [
          "CDDDCDD",
          "D.....D",
          "D.....D",
          "D.....D",
          "C.....D",
          "D.....D",
          "D.....D",
          "D.....D",
          "CDD.CDD"
        ],
        [
          "CDDDCDD",
          "D.....D",
          "D.....D",
          "D.....D",
          "C.....D",
          "D.....D",
          "D.....D",
          "D.....D",
          "CDDCCDD"
        ],
        [
          "CBBBCBB",
          "B.....B",
          "B.....B",
          "B.....B",
          "C.....B",
          "B.....B",
          "B.....B",
          "B.....B",
          "CBBBCBB"
        ],
        [
          "CCCCCCC",
          "CBBBBBC",
          "CBFBBBC",
          "CBBBBBC",
          "CBBBBBC",
          "CBBBBBC",
          "CBBBBBC",
          "CBBBBBC",
          "CCCCCCC"
        ],
        [
          "EEEEEEE",
          "E.....E",
          "E.F...E",
          "E.....E",
          "E.....E",
          "E.....E",
          "E.....E",
          "E.....E",
          "EEEEEEE"
        ],
        [
          ".......",
          ".EEEEE.",
          ".EF..E.",
          ".E...E.",
          ".E...E.",
          ".E...E.",
          ".E...E.",
          ".EEEEE.",
          "......."
        ],
        [
          ".......",
          ".......",
          "..FEE..",
          "..E.E..",
          "..E.E..",
          "..E.E..",
          "..EEE..",
          ".......",
          "......."
        ],
        [
          ".......",
          ".......",
          "..F....",
          "...E...",
          "...E...",
          "...E...",
          ".......",
          ".......",
          "......."
        ],
        [
          ".......",
          ".......",
          "..F....",
          ".......",
          ".......",
          ".......",
          ".......",
          ".......",
          "......."
        ]
      ]
    },
    {
      "id": "store",
      "role": "annex",
      "origin": [
        12,
        1
      ],
      "mask": [
        "#####",
        "#####",
        "#####",
        "#####",
        "#####",
        "#####",
        "#####"
      ],
      "layers": [
        [
          "AAAAA",
          "AAAAA",
          "AAAAA",
          "AAAAA",
          "AAAAA",
          "AAAAA",
          "AAAAA"
        ],
        [
          "CBBBC",
          "B...B",
          "B...B",
          "B...B",
          "C...C",
          "B...B",
          "BB.BB"
        ],
        [
          "CDDDC",
          "D...D",
          "D...D",
          "D...D",
          "C...C",
          "D...D",
          "DD.DD"
        ],
        [
          "CDDDC",
          "D...D",
          "D...D",
          "D...D",
          "C...C",
          "D...D",
          "DDCDD"
        ],
        [
          "CCCCC",
          "C...C",
          "C.F.C",
          "C...C",
          "C...C",
          "C...C",
          "CCCCC"
        ],
        [
          "EEEEE",
          "E...E",
          "E.F.E",
          "E...E",
          "E...E",
          "E...E",
          "EEEEE"
        ],
        [
          ".....",
          ".EEE.",
          ".EFE.",
          ".E.E.",
          ".E.E.",
          ".EEE.",
          "....."
        ],
        [
          ".....",
          ".....",
          "..F..",
          "..E..",
          "..E..",
          ".....",
          "....."
        ],
        [
          ".....",
          ".....",
          "..F..",
          ".....",
          ".....",
          ".....",
          "....."
        ]
      ]
    },
    {
      "id": "yard",
      "role": "courtyard",
      "origin": [
        0,
        0
      ],
      "mask": [
        "###################",
        "#.......####.....##",
        "#.......####.....##",
        "#.......####.....##",
        "#.......####.....##",
        "#.......####.....##",
        "#.......####.....##",
        "#.......####.....##",
        "#.......###########",
        "#.......###########",
        "###################",
        "###################",
        "###################",
        "###################",
        "###################",
        "###################",
        "###################",
        "###################",
        "###################"
      ],
      "layers": [
        [
          "ggggggggggpgggggggg",
          "g.......ggpg.....gg",
          "g.......ggpg.....gg",
          "g.......ggpg.....gg",
          "g.......ggpg.....gg",
          "g.......ggpg.....gg",
          "g.......ggpg.....gg",
          "g.......ggpg.....gg",
          "g.......ggpgggggggg",
          "g.......ggpgggggggg",
          "ggggggggggpgggggggg",
          "ggggggggggpgggggggg",
          "ppppppppppppppppppp",
          "ppppppppppppppppppp",
          "ppppppppppppppppppp",
          "ppppppppppppppppppp",
          "ppppppppppppppppppp",
          "ppppppppppppppppppp",
          "ppppppppppppppppppp"
        ]
      ]
    }
  ],
  "entrances": [
    {
      "x": 10,
      "z": 18,
      "facing": "SOUTH"
    },
    {
      "x": 0,
      "z": 15,
      "facing": "WEST"
    },
    {
      "x": 18,
      "z": 15,
      "facing": "EAST"
    }
  ]
}
